name,category,url,careers_url,job_board,description,applied
HAProxy,,https://haproxy.com,https://haproxy.com/company/careers,custom,"Simplify, scale, and secure modern applications, APIs, and AI services in any environment. HAProxy Technologies is the company behind HAProxy.",False
EnvoyProxy,,https://envoyproxy.com,,,"Envoy is an open source edge and service proxy, designed for cloud-native applications",False
QUIC/Protocol Labs,,,,,,False
Linux Foundation,,https://linuxfoundation.org,https://www.linuxfoundation.org/about/join?hsLang=en,custom,"Helping open technology projects build world class open source software, communities and companies.",False
Apache Software Foundation,,,,,,False
Cloud Native Computing Foundation,,,,,,False
Open Source Initiative,,,,,,False
Mozilla,,https://mozilla.com,https://mozilla.com/careers,custom,"Firefox is a free web browser backed by Mozilla, a non-profit dedicated to internet health and privacy.",False
Red Hat,,https://redhat.com,https://redhat.com/en/jobs,custom,"Red Hat is the world’s leading provider of open source solutions, using a community-powered approach to provide reliable and high-performing cloud, virtualization, storage, Linux, and middleware technologies. Red Hat also offers award-winning support, training, and consulting services. Red Hat is an S&P 500 company with more than 80 offices spanning the globe, empowering its customers’ businesses.",False
Canonical,,https://canonical.com,https://ubuntu.com/blog/canonical-joins-the-connectivity-standards-alliance,custom,"Drive innovation in your enterprise with trusted open source from Canonical — simple, cost-effective, and supported.",False
Debian,,https://debian.com,,,,False
OpenBSD Foundation,,,,,,False
FreeBSD Foundation,,,,,,False
Rust Foundation,,,,,,False
Python Software Foundation,,https://python-software-foundation.com,,,,False
PHP Foundation,,,,,,False
Go Foundation,,https://gofoundation.com,,,,False
Kubernetes Foundation,,,,,,False
Boston Dynamics,,https://bostondynamics.com,https://bostondynamics.com/careers/,custom,"A leading global robotics company, Boston Dynamics builds practical robotics to tackle your toughest automation challenges and change your idea of what robots can do.",False
Nvidia,,https://nvidia.com,https://nvidianews.nvidia.com/news/nvidia-and-emerald-ai-join-leading-energy-companies-to-pioneer-flexible-ai-factories-as-grid-assets,custom,We create the world’s fastest supercomputer and largest gaming platform.,False
Intel,,https://intel.com,https://intel.com/jobs,custom,You can easily search the entire Intel.com site in several ways.,False
AMD,,https://amd.com,https://amd.com/pt/corporate/careers.html,custom,"A AMD oferece soluções de computação adaptativa e de alto desempenho de liderança para promover IA de data center, PCs com IA, dispositivos de borda inteligentes, jogos e muito mais.",False
Apple Silicon,,,,,,False
Qualcomm,,https://qualcomm.com,https://qualcomm.com/careers,custom,"Learn how Qualcomm transforms industries with leading edge AI, high-performance, low-power computing and unrivaled connectivity.",False
Broadcom,,https://broadcom.com,https://broadcom.com/careers,custom,"Broadcom delivers semiconductors and infrastructure software for global enterprises’ most complex, mission-critical needs.",False
Mobileye/Intel,,,,,,False
Tesla,,https://tesla.com,https://tesla.com/careers,custom,"Reference #18.5dbc2f17.1777183988.de0f327
https://errors.edgesuite.net/18.5dbc2f17.1777183988.de0f327",False
Anduril,,https://anduril.com,https://anduril.com/careers,greenhouse,"Anduril Industries builds advanced autonomous systems and defense technology to protect US and allied forces. Creating the future of national security through AI, robotics, and cutting-edge engineering.",False
Stripe,,https://stripe.com,https://stripe.com/pt-pt/jobs,custom,"Stripe é uma plataforma de serviços financeiros que ajuda todos os tipos de empresas a aceitar pagamentos, construir modelos flexíveis de faturamento e gerenciar movimentação de dinheiro.",False
Square,,https://square.com,https://block.xyz/careers/jobs,greenhouse,Sell anywhere. Diversify revenue streams. Streamline operations. Manage your staff. Get paid faster. Sign up for Square today.,False
Slack,,https://slack.com,https://slack.com/careers,custom,"Boost productivity and save time with Slack‌ — ‌the AI work platform for managing projects, automating workflows, and connecting teams securely. Start working smarter today.",False
Discord,,https://discord.com,https://discord.com/careers,custom,"Discord is great for playing games and chilling with friends, or even building a worldwide community. Customize your own space to talk, play, and hang out.",False
Notion,,https://notion.so,https://notion.so/careers,custom,"Build Custom Agents, search across all your apps, and automate busywork. The AI workspace where teams get more done, faster.",False
Airtable,,https://airtable.com,https://airtable.com/careers,custom,"500,000+ brands use Airtable to enable real-time collaboration, automate repetitive tasks & manual work, and streamline business processes in minutes. Join them.",False
Zapier,,https://zapier.com,https://zapier.com/early-access,custom,"Build and scale AI workflows and agents across 9,000+ apps with Zapier—the most connected AI orchestration platform. Trusted by 3 million+ businesses.",False
IFTTT,,https://ifttt.com,https://ifttt.com/join,custom,"Get started with IFTTT, the easiest way to automate your favorite apps and devices for free. Make your home more relaxing. Make your work more productive. We...",False
Twilio,,https://twilio.com,https://jobs.twilio.com/careers,greenhouse,"Create amazing customer experiences with our Customer Engagement Platform (CEP) that combines communication APIs with AI. Build solutions for SMS, WhatsApp, voice, and email.",False
Auth0,,https://auth0.com,https://auth0.com/resources/webinars/introducing-auth-for-genai-the-future-of-ai-security,custom,"Secure users, AI agents, and more with Auth0, an easy-to-implement, scalable, and adaptable authentication and authorization platform.",False
