name,category,url,careers_url,job_board,description,applied
Render,,https://render.com,https://render.com/docs/cronjobs,custom,Deploy and scale any app or agent from your first user to your billionth. Build faster on intuitive cloud infrastructure for the modern web.,False
DigitalOcean,,https://digitalocean.com,https://digitalocean.com/careers,custom,"Build on DigitalOcean's unified agentic AI cloud infrastructure. AI-powered development, instant deployment, easy management. Simple and affordable.",False
CoreWeave,,https://coreweave.com,https://coreweave.com/events,custom,"CoreWeave is the force multiplier that empowers pioneers with momentum, magnitude, and mastery—enabling them to innovate with confidence. Explore the #1 AI Cloud.",False
Lambda Labs,,https://lambda-labs.com,,,High-performance speakers designed and crafted in Austria.,False
Databricks,,https://databricks.com,https://databricks.com/company/careers,greenhouse,"Databricks offers a unified platform for data, analytics and AI. Build better AI with a data-centric approach. Simplify ETL, data warehousing, governance and AI on the Data Intelligence Platform.",False
Vercel,,https://vercel.com,https://vercel.com/events,custom,"Vercel gives developers the frameworks, workflows, and infrastructure to build a faster, more personalized web.",False
Netlify,,https://netlify.com,https://netlify.com/careers/,greenhouse,"Create with AI or code, deploy instantly on production infrastructure. One platform to build and ship.",False
Docker,,https://docker.com,https://docker.com/careers/,custom,"Docker is a platform designed to help developers build, share, and run container applications. We handle the tedious setup, so you can focus on the code.",False
Canonical,,https://canonical.com,https://ubuntu.com/blog/canonical-joins-the-connectivity-standards-alliance,custom,"Drive innovation in your enterprise with trusted open source from Canonical — simple, cost-effective, and supported.",False
Red Hat,,https://redhat.com,https://redhat.com/en/jobs,custom,"Red Hat is the world’s leading provider of open source solutions, using a community-powered approach to provide reliable and high-performing cloud, virtualization, storage, Linux, and middleware technologies. Red Hat also offers award-winning support, training, and consulting services. Red Hat is an S&P 500 company with more than 80 offices spanning the globe, empowering its customers’ businesses.",False
HashiCorp,,https://hashicorp.com,,,We're verifying your browser,False
CloudFlare,,https://cloudflare.com,https://discord.com/invite/cloudflaredev,custom,"Make employees, applications and networks faster and more secure everywhere, while reducing complexity and cost.",False
AWS/Amazon,,https://awsamazon.co,,,,False
Google Cloud,,https://cloud.google.com,https://developers.google.com/program/gear/?utm_source=web&utm_medium=cgc&utm_campaign=FY26-Q2-GLOBAL-GOO38926-onlineevent-er-gear-135947-web-AgentPlatform-cgchomepage&utm_content=Next26&utm_term=-,custom,"Meet your business challenges head on with AI and cloud computing services from Google, including security, data management, and hybrid & multi-cloud.",False
Microsoft Azure,,https://azure.microsoft.com,,,"Invent with purpose, realize cost savings, and make your organization more efficient with Microsoft Azure’s open and flexible cloud computing platform.",False
IBM Cloud,,https://ibmcloud.com,https://ibmcloud.com/careers,greenhouse,"IBM Cloud with Red Hat offers market-leading security, enterprise scalability and open innovation to unlock the full potential of cloud and AI.",False
Oracle Cloud,,https://oracle-cloud.com,,,,False
Linode/Akamai,,,,,,False
Vultr,,https://vultr.com,https://vultr.com/resources/partners/,custom,Vultr Global Cloud Hosting - Brilliantly Fast SSD VPS Cloud Servers. 100% KVM Virtualization,False
Hetzner,,https://hetzner.com,https://career.hetzner.com/de/,custom,"Günstige Hosting-Lösungen, Dedicated Server und Cloud-Services bei Hetzner ✓ DSGVO-konform ✓ günstige Preise  ✓ 100 % grüne Energie",False
OVH,,https://ovh.com,https://ovh.com/careers,ats,"A OVHcloud oferece mais de 80 serviços, abertos e reversíveis, com a melhor relação preço/desempenho: nomes de domínio, VPS, servidores dedicados, cloud IaaS e PaaS.",False
Exoscale,,https://exoscale.com,https://exoscale.com/jobs/,custom,"Exoscale is your European sovereign cloud hosting provider! High performance, GDPR compliant, Secure & scalable for EU businesses.",False
Scaleway,,https://scaleway.com,https://scaleway.com/en/serverless-jobs/,custom,"Build on a secure, transparent, and fast-moving cloud & AI platform built for what’s next.",False
UpCloud,,,,,,False
Heroku/Salesforce,,,,,,False
PingCAP,,https://pingcap.com,https://pingcap.com/tidb-scaile-summit/2026-europe/,custom,"TiDB is the distributed SQL database built for AI agents. Vectors, transactions, and analytics in one engine with ACID guarantees and elastic scale.",False
Cockroach Labs,,https://cockroach-labs.com,https://cockroach-labs.com/careers,custom,"Welcome to my website. In case you came here to purchase a domain name: this is the right spot.
I'm a german IT guy purchasing interesting domain names and then re-selling them once I no longer have use for them.",False
PlanetScale,,https://planetscale.com,https://planetscale.com/careers,greenhouse,PlanetScale offers the world’s fastest and most scalable cloud hosting for Vitess and Postgres.,False
Neon,,https://neon.com,https://www.databricks.com/company/careers/open-positions?department=engineering&location=all&itm_source=www&itm_category=company&itm_page=engineering-at-databricks&itm_location=body&itm_component=hero&itm_offer=open-positions,greenhouse,"The database you love, on a serverless platform designed to help you build reliable and scalable applications faster.",False
Supabase,,https://supabase.com,https://supabase.com/docs/guides/database/tables?queryGroups=database-method&database-method=sql&queryGroups=language&language=js#joining-tables-with-foreign-keys,custom,"Build production-grade applications with a Postgres database, Authentication, instant APIs, Realtime, Functions, Storage and Vector embeddings. Start for free.",False
Firebase/Google,,,,,,False
Parse Server,,,,,,False
Convex,,https://convex.com,https://convex.com/careers,custom,The only sales intelligence platform built for commercial services teams to reach decision-makers and win more deals across 5.9 M+ properties.,False
Hasura,,https://hasura.com,https://hasura.io/careers,custom,"Hasura delivers accurate, fast, and secure data access for AI and digital experiences. Trusted by data leaders and developers at Fortune 100 companies and high-growth AI and digital natives.",False
AWS Lambda,,https://awslambda.com,,,,False
Google Cloud Functions,,,,,,False
Azure Functions,,,,,,False
Cloudflare Workers,,https://cloudflareworkers.com,,,,False
Deno Deploy,,,,,,False
Begin,,https://begin.ai,,,We help you begin your AI journey in a meaningful way.,False
Netlify Functions,,,,,,False
SUSE,,https://suse.com,https://jobs.suse.com/,custom,"Modernize your infrastructure with SUSE Linux Enterprise servers, cloud technology for IaaS, and SUSE's software-defined...",False
Rancher,,https://rancher.com,https://rancher.com/community,custom,"Rancher, the open-source multi-cluster orchestration platform, lets operations teams deploy, manage and secure enterprise Kubernetes. Request a demo!",False
JFrog,,https://jfrog.com,https://join.jfrog.com/,custom,JFrog software supply chain solutions provide an end-to-end pipeline to control your binaries from build to production. Power your software updates to the edge.,False
CloudBees,,https://cloudbees.com,https://www.cloudbees.com/careers,custom,"CloudBees Unify is the enterprise control and context plane for your entire AI-powered software delivery lifecycle: open, multi-agentic, and continuously secure.",False
GitLab,,https://gitlab.com,https://gitlab.com/jobs/,custom,Your intelligent orchestration platform for DevSecOps,False
GitHub/Microsoft,,,,,,False
MongoDB,,https://mongodb.com,https://www.mongodb.com/community/,custom,"Get your ideas to market faster with a flexible, AI-ready database. MongoDB makes working with data easy.",False
Elastic,,https://elastic.co,https://elastic.co/community,custom,Power insights and outcomes with The Elasticsearch Platform. See into your data and find answers that matter with enterprise solutions designed to help you accelerate time to insight. Try Elastic toda...,False
Splunk,,https://splunk.com,https://careers.cisco.com/global/en/splunk,custom,"Splunk is the key to enterprise resilience. Our platform enables organizations around the world to prevent major issues, absorb shocks and accelerate digital transformation.",False
Databricks,,https://databricks.com,https://databricks.com/company/careers,greenhouse,"Databricks offers a unified platform for data, analytics and AI. Build better AI with a data-centric approach. Simplify ETL, data warehousing, governance and AI on the Data Intelligence Platform.",False
Snowflake,,https://snowflake.com,https://snowflake.com/en/summit/,custom,"Snowflake enables organizations to collaborate, build AI-powered data apps, and unlock data insights—all within a secure and scalable AI Data Cloud.",False
Teradata,,https://teradata.com,https://teradata.com/about-us/careers,custom,"Teradata is the AI platform for the autonomous era, connecting and scaling across any environment.",False
Vertica,,https://vertica.com,https://careers.opentext.com/,custom,OpenText Analytics Database unlocks advanced analytics capabilities across data warehouse and data lakehouse environments with unmatched performance,False
ClickHouse,,https://clickhouse.com,https://clickhouse.com/company/careers,custom,ClickHouse is a fast open-source column-oriented database management system that allows generating analytical data reports in real-time using SQL queries,False
DuckDB,,https://duckdb.org,https://duckdb.org/docs/current/guides/sql_features/asof_join.html,custom,"DuckDB is an in-process SQL OLAP database management system. Simple, feature-rich, fast & open source.",False
InfluxDB,,https://influxdata.com,https://influxdata.com/careers/,custom,,False
Timescale,,https://timescale.com,https://timescale.com/careers,custom,From the creators of TimescaleDB — the PostgreSQL platform trusted by enterprises processing trillions of metrics daily. Start a free trial or get a demo.,False
VictoriaMetrics,,https://victoriametrics.com,https://careers.victoriametrics.com/,custom,Incredibly fast time series database and easy-to-use high performance monitoring solutions simple and reliable for everyone. VictoriaMetrics Database Solutions.Incredibly fast time series database and easy-to-use high performance monitoring solutions simple and reliable for everyone. VictoriaMetrics Database Solutions.,False
Prometheus/CNCF,,,,,,False
Grafana,,https://grafana.com,https://grafana.com/careers/,greenhouse,,False
New Relic,,https://newrelic.com,https://newrelic.com/about/culture,custom,"New Relic is an AI-powered observability platform that correlates your telemetry across your entire stack, so you can isolate the root cause and reduce MTTR.",False
Datadog,,https://datadoghq.com,https://www.datadoghq.com/product/data-observability/jobs-monitoring/,custom,"See metrics from all of your apps, tools & services in one place with Datadog’s cloud monitoring as a service solution. Try it for free.",False
Dynatrace,,https://dynatrace.com,https://dynatrace.com/careers,custom,"Innovate faster, operate more efficiently, and drive better business outcomes with observability, AI, automation, and application security in one platform.",False
Sumo Logic,,https://sumo-logic.xyz,,,Helping builders shape the future of Web3. Boosting the coolest crypto projects.,False
Observability/New Relic,,,,,,False
PagerDuty,,https://pagerduty.com,https://careers.pagerduty.com/home,greenhouse,"Turn incidents into intelligence. PagerDuty's AI-first Operations Platform helps you automate, resolve, and prevent critical issues — from detection to resolution.",False
Honeycomb.io,,https://honeycomb.io,https://honeycombpollinators.slack.com/join/shared_invite/zt-36l4bm56r-HDRSbqbQvjGPeH1VIhMmSw#/shared-invite/email,custom,"Honeycomb is the observability platform built for AI-era software. Fast queries, unified telemetry, and LLM observability. Used by Slack, Intercom, and Dropbox.",False
Moogsoft,,https://moogsoft.com,https://www.moogsoft.com/careers/,lever,Moogsoft AIOps ensures continuous availability with automated noise reduction via industry leading anomaly detection algorithms. Learn more.,False
Opsgenie,,https://opsgenie.com,https://community.atlassian.com/forums/Opsgenie-Migration/gh-p/opsgenie-migration,custom,Access everything you need to guide your migration journey from Opsgenie.,False
Squadcast,,https://squadcast.com,https://squadcast.com/product/slos-and-error-budget,custom,Squadcast is a full stack Reliability Automation and Incident Response Platform that's designed to help you promote SRE best practices. Try it for free now!,False
ilert,,https://ilert.com,https://ilert.com/careers,custom,"AI-first platform for alerting, on-call management, and status pages. Sign up for a free 14-day trial!",False
VictorOps,,https://victorops.com,https://careers.cisco.com/global/en/splunk,custom,"VictorOps is now Splunk On-Call — new name, updated product. Learn more about the VictorOps acquisition.",False
BigPanda,,https://bigpanda.com,,,,False
Augtera,,https://augtera.com,https://nvidianews.nvidia.com/news/nvidia-launches-nemotron-coalition-of-leading-global-ai-labs-to-advance-open-frontier-models?nvid=nv-int-csfg-143333,custom,We create the world’s fastest supercomputer and largest gaming platform.,False
Cisco AppDynamics,,,,,,False
Appdynamics,,https://appdynamics.com,https://www.splunk.com/de_de/appdynamics-joins-splunk.html,custom,"Get unified observability across any environment, any stack. Ensure resilience of digital systems, identify problems proactively, find root causes, and resolve them fast.",False
Auth0,,https://auth0.com,https://auth0.com/resources/webinars/introducing-auth-for-genai-the-future-of-ai-security,custom,"Secure users, AI agents, and more with Auth0, an easy-to-implement, scalable, and adaptable authentication and authorization platform.",False
Okta,,https://okta.com,https://support.okta.com/help/s/community?language=en_US,custom,"The Okta and Auth0 Platforms enable secure access, authentication, and automation — putting Identity at the heart of business security and growth.",False
Zoom,,https://zoom.us,https://zoom.us/join,custom,"Modernize workflows with Zoom's trusted collaboration tools: including video meetings, Zoom Chat, VoIP phone, webinars, whiteboard, contact center, and events.",False
Signal,,https://signal.org,https://signal.org/workworkwork/,custom,"Say ""hello"" to a different messaging experience. An unexpected focus on privacy, combined with all of the features you expect.",False
Mullvad,,https://mullvad.net,https://www.mullvad.careers/,custom,Free the internet from mass surveillance and censorship. Fight for privacy with Mullvad VPN and Mullvad Browser.,False
1Password,,https://1password.com,https://1password.com/careers,custom,"Protect passwords and secrets, manage app access, and secure AI tools with 1Password. Easy to adopt from growing teams to enterprise.",False
Teleport,,https://goteleport.com,https://goteleport.com/community-slack/,custom,"Teleport unifies identities — humans, machines, and AI — with strong identity implementation to speed up engineering, improve resiliency against identity-based attacks, and secure AI in production infrastructure.",False
Snyk,,https://snyk.io,https://snyk.io/careers/,custom,"Snyk is the AI Security Fabric. Secure at inception with continuous, autonomous defense for AI-generated code and AI-native apps. Unleash AI innovation securely. Book a demo.",False
Wiz,,https://wiz.io,https://wiz.io/careers,greenhouse,"Wiz connects code, cloud, and runtime into one agentic cybersecurity platform. Prevent risk, detect threats, and start secure – across every cloud and AI layer.",False
Zscaler,,https://zscaler.com,https://zscaler.com/careers,custom,Zscaler is a leading cloud enterprise security provider helping global businesses adopt zero trust for secure digital transformation.,False
Vanta,,https://vanta.com,https://vanta.com/products/grc,custom,"Vanta automates the complex and time-consuming process of SOC 2, HIPAA, ISO 27001, PCI, and GDPR compliance certification. Automate your security monitoring in weeks instead of months.",False
Rubrik,,https://rubrik.com,https://www.rubrik.com/company/careers,custom,"Organizations rely on Rubrik for resilience against cyber attacks and operational disruptions with automation, fast recovery and easy cloud adoption.",False
CrowdStrike,,https://crowdstrike.com,https://crowdstrike.com/en-us/careers/,custom,"CrowdStrike is a global cybersecurity leader with an advanced cloud-native platform for protecting endpoints, cloud workloads, identities and data.",False
SentinelOne,,https://sentinelone.com,https://www.sentinelone.com/lp/cyber-forum-threat-intel/,custom,"SentinelOne unifies AI-powered endpoint, cloud, identity, and data protection—enhanced by our Security Data Lake for seamless and efficient cybersecurity.",False
Palo Alto Networks,,https://palo-alto-networks.ai,,,,False
Fortinet,,https://fortinet.com,https://fortinet.com/partners/technology-alliances/join-the-ecosystem,custom,"Fortinet delivers cybersecurity everywhere you need it. We secure the entire digital attack surface from devices, data, and apps and from data center to home office.",False
Rapid7,,https://rapid7.com,https://careers.rapid7.com/,greenhouse,"Outpace attackers with the only endpoint to cloud, unified cybersecurity platform. Build business resilience with expert-led 24/7 MDR.",False
Qualys,,https://qualys.com,https://www.brighttalk.com/series/6463,custom,Discover how Qualys helps your business measure & eliminate cyber threats through a host of cybersecurity detection & remediation tools. Try it today!,False
Tenable,,https://tenable.com,https://tenable.com/careers,greenhouse,"As a leader in vulnerability management, Tenable helps you know, expose and close cyber risk using robust cloud security and exposure management tools.",False
Tripwire,,https://tripwire.io,https://tripwire.io/careers,custom,,False
Imperva,,https://imperva.com,https://imperva.com/company/careers/,custom,As you were browsing something about your browser made us think you were a bot. There are a few reasons this might happen:,False
F5,,https://f5.com,https://www.f5.com/company/careers,custom,F5 application services ensure that applications are always secure and perform the way they should—in any environment and on any device.,False
Akamai,,https://akamai.com,https://partners.akamai.com/registration/,custom,Akamai is the cybersecurity and cloud computing company that powers and protects business online.,False
Cloudflare,,https://cloudflare.com,https://discord.com/invite/cloudflaredev,custom,"Make employees, applications and networks faster and more secure everywhere, while reducing complexity and cost.",False
Fastly,,https://fastly.com,https://fastly.com/about/careers,custom,"Fastly's edge cloud platform delivers faster, safer, and more scalable sites and apps to customers. Elevate your edge CDN, video delivery, security, and more.",False
Cisco,,https://cisco.com,https://careers.cisco.com/global/en/home,custom,"Cisco is a worldwide technology leader powering an inclusive future for all. Learn more about our products, services, solutions, and innovations.",False
CheckPoint,,https://checkpoint.com,,,,False
Juniper,,https://juniper.com,https://www.barclaycardus.com/apply/aboutbarclaycardus/joinbarclays.html,custom,"To continue accessing and managing your account, please update your browser.",False
Fortinet,,https://fortinet.com,https://fortinet.com/partners/technology-alliances/join-the-ecosystem,custom,"Fortinet delivers cybersecurity everywhere you need it. We secure the entire digital attack surface from devices, data, and apps and from data center to home office.",False
Barracuda,,https://barracuda.com,https://www.barracuda.com/support/join-community,custom,"Barracuda Networks is the worldwide leader in Email Protection, Application Protection, Network Security, and Data Protection Solutions",False
Sophos,,https://sophos.com,https://sophos.com/pt-br/company/careers,lever,"A Sophos defende a sua organização de ataques cibernéticos inevitáveis com defesas e conhecimentos inovadores e adaptativos que estão ao seu serviço, protegendo o futuro do seu negócio com confiança.",False
Avast,,https://avast.com,https://avast.com/careers,custom,"Faça como centenas de milhões de outros utilizadores e obtenha antivírus gratuito para PC, Mac e Android. Navegue em segurança com a nossa VPN. Transfira o Avast!",False
Norton/Symantec,,https://nortonsymantec.com,https://nortonsymantec.com/careers,custom,,False
Kaspersky,,https://kaspersky.com,https://careers.kaspersky.com/,custom,"Official Site – A Global Leader in next-generation cybersecurity solutions and services, Kaspersky offers premium protection against all cyber threats for your home and business.",False
Bitdefender,,https://bitdefender.com,https://bitdefender.com/pt-pt/company/careers,custom,"A Bitdefender é líder em software de cibersegurança ao proporcionar as melhores soluções de prevenção, deteção e resposta a ameaças em todo o mundo.",False
GitHub/Microsoft,,,,,,False
GitLab,,https://gitlab.com,https://gitlab.com/jobs/,custom,Your intelligent orchestration platform for DevSecOps,False
Atlassian,,https://atlassian.com,https://atlassian.com/company/careers,custom,"Atlassian's team collaboration software like Jira, Confluence and Trello help teams organize, discuss, and complete shared work.",False
JetBrains,,https://jetbrains.com,https://jetbrains.com/careers,custom,"JetBrains is a cutting-edge software vendor specializing in the creation of intelligent development tools, including IntelliJ IDEA – the leading Java IDE, and the Kotlin programming language.",False
Visual Studio/Microsoft,,,,,,False
VSCode/Microsoft,,,,,,False
Sublime Text,,https://sublime-text.com,,,精雕细琢的代码、标记与文本编辑器。GPU 加速、Apple Silicon 原生、多选标签、并排定义 —— 让每一次敲击都如丝般顺滑。,False
Nova/Panic,,,,,,False
Cursor,,https://cursor.com,https://cursor.com/careers,custom,"Built to make you extraordinarily productive, Cursor is the best way to build software with AI.",False
Copilot,,https://copilot.com,https://copilot.com/careers,custom,"Microsoft Copilot is your companion to inform, entertain and inspire. Get advice, feedback and straightforward answers. Try Copilot now.",False
Continue,,https://continue.com,,,Continue Research is a global research initiative focused on extending healthy human lifespan and making it accessible to everyone.,False
Replit,,https://replit.com,https://replit.com/signup?goto=%2F%7E%3Fupgrade%3Dpricing_page_signup%26plan%3Dhacker_pro%26period%3Dyearly,custom,Build and deploy software collaboratively with the power of AI without spending a second on setup.,False
Glitch,,https://glitch.com,https://glitch.com/careers,custom,The official blog for glitch.com,False
CodePen,,https://codepen.ai,,,Own codepen.ai today. Secure checkout and guided transfer support. No hidden fees.,False
JSFiddle,,,,,,False
Cloudflare,,https://cloudflare.com,https://discord.com/invite/cloudflaredev,custom,"Make employees, applications and networks faster and more secure everywhere, while reducing complexity and cost.",False
Fastly,,https://fastly.com,https://fastly.com/about/careers,custom,"Fastly's edge cloud platform delivers faster, safer, and more scalable sites and apps to customers. Elevate your edge CDN, video delivery, security, and more.",False
Akamai,,https://akamai.com,https://partners.akamai.com/registration/,custom,Akamai is the cybersecurity and cloud computing company that powers and protects business online.,False
Cisco,,https://cisco.com,https://careers.cisco.com/global/en/home,custom,"Cisco is a worldwide technology leader powering an inclusive future for all. Learn more about our products, services, solutions, and innovations.",False
Arista Networks,,https://arista.com,,,,False
Juniper Networks,,https://juniper.net,https://careers.hpe.com/juniper,custom,"Proven AI for your network. Mist, the AI-native networking platform makes every connection more reliable, measurable, and secure for businesses.",False
Incapsula,,,,,,False
Radware,,https://radware.com,https://radware.com/careers,custom,...but your activity and behavior on this site made us think that you are a bot.,False
A10 Networks,,https://a10networks.com,https://a10networks.com/company/careers/,custom,"A10 offers application security and infrastructure solutions to help you build high-performance, AI-ready infrastructure for mission-critical apps and networks.",False
Citrix,,https://citrix.com,https://careers.cloud.com/,greenhouse,"Discover the new Citrix platform, revolutionizing application delivery with enhanced security, Zero Trust frameworks, and unmatched performance. Dive into industry-specific solutions for healthcare, financial services, and government. Uncover new use cases with Citrix and NetScaler, from centralized app management to mission-critical application delivery.",False
F5,,https://f5.com,https://www.f5.com/company/careers,custom,F5 application services ensure that applications are always secure and perform the way they should—in any environment and on any device.,False
Nginx/F5,,,,,,False
